{
  "$schema": "https://json-schema.org/draft/2020-12/schema",
  "$id": "https://linhongcun.github.io/aoe2-analyzer/schema/content-events.json",
  "type": "object",
  "properties": {
    "schemaVersion": {
      "const": 1
    },
    "checkedAt": {
      "$ref": "#/$defs/date"
    },
    "sources": {
      "type": "array",
      "items": {
        "$ref": "#/$defs/source"
      }
    },
    "events": {
      "type": "array",
      "items": {
        "$ref": "#/$defs/event"
      }
    }
  },
  "required": ["schemaVersion", "checkedAt", "sources", "events"],
  "additionalProperties": false,
  "$defs": {
    "text": {
      "allOf": [
        {
          "$ref": "common.defs.json#/$defs/sourceText"
        },
        {
          "type": "string",
          "pattern": "\\S",
          "maxLength": 2000
        }
      ]
    },
    "id": {
      "type": "string",
      "pattern": "^[a-z0-9]+(?:-[a-z0-9]+)*$",
      "maxLength": 80
    },
    "date": {
      "type": "string",
      "pattern": "^\\d{4}-\\d{2}-\\d{2}$"
    },
    "timestamp": {
      "type": ["string", "null"],
      "pattern": "^\\d{4}-\\d{2}-\\d{2}T\\d{2}:\\d{2}:\\d{2}(?:\\.\\d{1,3})?(?:Z|[+-]\\d{2}:\\d{2})$"
    },
    "evidence": {
      "type": "object",
      "properties": {
        "sourceId": {
          "$ref": "#/$defs/id"
        },
        "locator": {
          "$ref": "#/$defs/text"
        }
      },
      "required": ["sourceId", "locator"],
      "additionalProperties": false
    },
    "evidenceList": {
      "type": "array",
      "items": {
        "$ref": "#/$defs/evidence"
      },
      "minItems": 1
    },
    "source": {
      "type": "object",
      "properties": {
        "id": {
          "$ref": "#/$defs/id"
        },
        "title": {
          "$ref": "#/$defs/text"
        },
        "url": {
          "allOf": [
            {
              "$ref": "common.defs.json#/$defs/publicUrl"
            },
            {
              "type": "string",
              "pattern": "^https://"
            }
          ]
        },
        "kind": {
          "enum": ["官方赛事公告", "主办方公告", "主办方公布名单"]
        },
        "sourcePublishedAt": {
          "$ref": "#/$defs/timestamp"
        },
        "publishedAt": {
          "anyOf": [
            {
              "$ref": "#/$defs/date"
            },
            {
              "type": "null"
            }
          ]
        },
        "checkedAt": {
          "$ref": "#/$defs/date"
        }
      },
      "required": ["id", "title", "url", "kind", "sourcePublishedAt", "publishedAt", "checkedAt"],
      "additionalProperties": false
    },
    "format": {
      "enum": ["1v1", "3v3-final"]
    },
    "role": {
      "type": "object",
      "properties": {
        "format": {
          "$ref": "#/$defs/format"
        },
        "team": {
          "anyOf": [
            {
              "$ref": "#/$defs/text"
            },
            {
              "type": "null"
            }
          ]
        },
        "evidence": {
          "$ref": "#/$defs/evidenceList"
        }
      },
      "required": ["format", "team", "evidence"],
      "additionalProperties": false,
      "allOf": [
        {
          "if": {
            "properties": {
              "format": {
                "const": "1v1"
              }
            }
          },
          "then": {
            "properties": {
              "team": {
                "type": "null"
              }
            }
          },
          "else": {
            "properties": {
              "team": {
                "$ref": "#/$defs/text"
              }
            }
          }
        }
      ]
    },
    "participant": {
      "type": "object",
      "properties": {
        "playerId": {
          "$ref": "#/$defs/id"
        },
        "roles": {
          "type": "array",
          "items": {
            "$ref": "#/$defs/role"
          },
          "minItems": 1
        }
      },
      "required": ["playerId", "roles"],
      "additionalProperties": false
    },
    "event": {
      "type": "object",
      "properties": {
        "id": {
          "$ref": "#/$defs/id"
        },
        "title": {
          "$ref": "#/$defs/text"
        },
        "game": {
          "const": "帝国时代 II：决定版"
        },
        "startDate": {
          "$ref": "#/$defs/date"
        },
        "endDate": {
          "$ref": "#/$defs/date"
        },
        "formats": {
          "type": "array",
          "items": {
            "$ref": "#/$defs/format"
          },
          "minItems": 1,
          "uniqueItems": true
        },
        "evidence": {
          "$ref": "#/$defs/evidenceList"
        },
        "participants": {
          "type": "array",
          "items": {
            "$ref": "#/$defs/participant"
          }
        }
      },
      "required": ["id", "title", "game", "startDate", "endDate", "formats", "evidence", "participants"],
      "additionalProperties": false
    }
  }
}
